115,116.0,复地(集团)股份有限公司,在营,王基平,25.04亿,人民币,1998-08-13,2022-11-22,上海市,-,普陀区,91310000631174736F,021-23155588,-,4,民营企业,股份有限公司,房地产业,房地产业,房地产开发经营,房地产开发经营,www.forte.com.cn,上海市普陀区曹杨路510号9楼,上海市黄浦区中山东二路600号外滩金融中心S1幢11楼,曾有债券发行,房地产开发、经营、房地产投资、物业管理及以上相关行业的咨询服务。 【依法须经批准的项目，经相关部门批准后方可开展经营活动】
116,117.0,江苏中南建设集团股份有限公司,在营,陈锦石,38.27亿,人民币,1998-07-28,2020-09-02,江苏省,南通市,海门区,91320600MA1M9AEW6B,0513-68702747,liangxiaojing@zhongnangroup.cn,6,民营企业,股份有限公司,房地产业,房地产业,房地产开发经营,房地产开发经营,www.zhongnangroup.cn,江苏省南通市海门区常乐镇,上海市长宁区天山西路1068号A栋9楼,曾有债券发行,"房地产开发、销售(凭资质证书承接业务);土木建筑工程施工,物业管理,实业投资;道路货运经营。"
117,118.0,华夏幸福基业控股股份公司,在营,王文学,10.5亿,人民币,1998-07-10,2021-07-14,河北省,廊坊市,固安县,91131000700769064N,15175682553,gongsilianxiren@zenity.cn,0,民营企业,股份有限公司,房地产业,房地产业,房地产开发经营,房地产开发经营,-,河北省廊坊市固安县新兴产业示范区卫星导航产业园44号楼北侧三层（科技大道北侧、规划三路西侧）,北京市朝阳区东三环北路霞光里18号佳程广场A座,曾有债券发行,对商业、制造业的投资；企业管理咨询；货物或技术的进出口（国家禁止或限制的项目除外）。
118,119.0,重庆新鸥鹏物业管理(集团)有限公司,在营,王小军,1.03亿,人民币,1998-06-17,2022-06-14,重庆市,-,江北区,91500105621973665U,13022376218,1558963248@qq.com,74,民营企业,有限责任公司,房地产业,房地产业,物业管理,物业管理,www.openwuye.com,重庆市江北区金源路66号附7号1-17,-,曾有债券发行,许可项目：城市生活垃圾清扫、收集；园林绿化、城市园林绿化工程设计，劳务派遣服务，建设工程设计，道路旅客运输经营，第二类增值电信业务，旅游业务，出版物零售，烟草制品零售，食品经营，餐饮服务，酒类经营（依法须经批准的项目，经相关部门批准后方可开展经营活动，具体经营项目以相关部门批准文件或许可证件为准） 一般项目：物业管理；制作、代理、发布国内外广告；房屋租赁（不含住宿服务）；房屋中介（不含房屋评估）；网站建设；室内外保洁服务；有害生物防治；城市粪便污水处理（化粪池清掏）；会议及展览服务；楼宇智能化管理服务；建筑物及设施设备运行、维修、管理；市政设施养护维修管理；观赏植物（不含林木种子生产、经营）租赁；园林绿化、城市园林绿化工程施工及养护；停车服务餐饮服务，日用百货销售，日用品批发，日用品销售，针纺织品及原料销售，针纺织品销售，文具用品批发，文具用品零售，体育用品及器材批发，体育用品及器材零售，五金产品批发，五金产品零售，农副产品销售，家用视听设备销售，涂料销售（不含危险化学品），卫生洁具销售，日用家电零售，家具销售，第二类医疗器械销售，灯具销售，建筑装饰材料销售，厨具卫具及日用杂品零售，工程管理服务，规划设计管理，图文设计制作，建筑用金属配件制造，家政服务，计算机软硬件及辅助设备批发，计算机软硬件及辅助设备零售（除依法须经批准的项目外，凭营业执照依法自主开展经营活动）
119,120.0,中庚置业集团有限公司,在营,薛来银,33亿,人民币,1998-05-21,2022-12-05,上海市,-,闵行区,91350000158178335R,021-33599000,zhaolan@zgsyjt.cn,0,民营企业,有限责任公司,房地产业,房地产业,房地产开发经营,房地产开发经营,www.zhonggenggroup.com,上海市闵行区闵虹路166弄1号3501室,-,曾有债券发行,一般项目：房地产开发，出售出租商品房及物业管理；针、纺织品，电子计算机及配件，通信设备，化工产品，汽车、摩托车零部件，建筑材料的批发；信息服务；农业科技领域内的技术转让、技术开发、技术研究、技术咨询；组织文化艺术交流活动；会议及展览服务；远程健康管理服务（医疗诊断、互联网、增值电信除外）；健康咨询服务（不含诊疗服务）；企业总部管理。（除依法须经批准的项目外，凭营业执照依法自主开展经营活动）
120,121.0,奥园集团有限公司,在营,林显团,61.1亿,人民币,1998-05-11,2023-03-31,广东省,广州市,番禺区,91440101707660360J,020-38686666,ayxinfang@aoyuan.net,96,民营企业,有限责任公司,房地产业,房地产业,房地产开发经营,房地产开发经营,www.aoyuan.com,广州市番禺区南村镇万惠一路48号2302,广州市番禺区万惠一路48号奥园集团大厦,曾有债券发行,房地产咨询;房地产经纪;物业管理;互联网销售（除销售需要许可的商品）;酒店管理;餐饮管理;项目策划与公关服务;咨询策划服务;企业形象策划;以自有资金从事投资活动;信息技术咨询服务;信息咨询服务（不含许可类信息咨询服务）;体育场地设施工程施工;体育用品及器材批发;体育用品及器材零售;体育赛事策划;体育竞赛组织;体育健康服务;健康咨询服务（不含诊疗服务）;养老服务;国内贸易代理;计算机及办公设备维修;网络技术服务;科技中介服务;业务培训（不含教育培训、职业技能培训等需取得许可的培训）;企业管理咨询;房地产开发经营
121,122.0,正兴隆房地产(深圳)有限公司,在营,黄敬舒,"4,000万",港元,1997-12-22,2022-04-19,广东省,深圳市,福田区,91440300618934411C,075523625180,79003307@qq.com,0,民营企业,有限责任公司,房地产业,房地产业,房地产开发经营,房地产开发经营,-,深圳市福田区深南大道和泰然大道交汇处绿景纪元大厦55层A1单元,深圳市深南中路6011号NEO大厦A座55层,曾有债券发行,一般经营项目是：在合法取得使用权的土地上从事房地产开发经营；物业管理；房地产经纪；房地产信息咨询；自有物业租赁。(法律、行政法规、国务院决定禁止的项目除外，限制的项目须取得许可后方可经营)，许可经营项目是：机动车停放服务。
122,123.0,重庆市迪马实业股份有限公司,在营,黄力进,24.92亿,人民币,1997-10-09,2023-10-30,重庆市,-,南岸区,9150000045041506X3,02381155666,-,4,民营企业,股份有限公司,房地产业,房地产业,房地产开发经营,房地产开发经营,www.dima.cn,重庆市南岸区长电路8号,重庆市南岸区南滨路东原1891D馆4楼,曾有债券发行,"制造、销售运钞车、特种车及零部件(按国家行业主管部门批准的车型组织生产、销售),上述汽车售后服务;销售汽车(不含九座及以下乘用车);经营本企业自产的机电产品出口业务(国家组织统一联合经营的出口商品除外)、本企业生产、科研所需的原辅材料、机械设备、仪器仪表及零配件的进口业务(国家实行核定公司经营的进口商品除外);电子产品、计算机软件、硬件及网络设施的技术开发及销售,计算机系统集成及相关信息服务(除国家有专项管理规定的项目外),销售建筑材料及装饰材料(不含危险化学品);工程管理服务;社会经纪咨询服务;货物及技术进出口;企业信息及网络技术服务;健康咨询服务(不含诊疗服务);国内贸易代理。"
123,124.0,福州融侨物业管理有限公司,在营,余华秀,472.99万,人民币,1997-10-05,2024-01-02,福建省,福州市,鼓楼区,913501006113378414,18650089005,447277518@qq.com,2380,港澳台企业,有限责任公司,房地产业,房地产业,物业管理,物业管理,www.rongqiao.com,福建省福州市鼓楼区西江滨大道66号融侨锦江花园B区5#、6#、7#、8#、9#、10#楼连接体地下0.1层04商业用房,-,曾有债券发行,一般项目：物业管理；房地产经纪；家政服务；城市绿化管理；专业保洁、清洗、消毒服务；日用电器修理；园林绿化工程施工；规划设计管理；信息咨询服务（不含许可类信息咨询服务）；互联网销售（除销售需要许可的商品）；广告设计、代理；广告发布；广告制作；住房租赁；停车场服务；集中式快速充电站；社会经济咨询服务；食品销售（仅销售预包装食品）；食品互联网销售（仅销售预包装食品）；保健食品（预包装）销售；日用百货销售。（除依法须经批准的项目外，凭营业执照依法自主开展经营活动）许可项目：第二类增值电信业务；食品销售；食品互联网销售。（依法须经批准的项目，经相关部门批准后方可开展经营活动，具体经营项目以相关部门批准文件或许可证件为准）
124,125.0,深圳市广森投资集团有限公司,在营,李森,1.08亿,人民币,1997-09-25,2020-09-22,广东省,深圳市,罗湖区,91440300279383730H,075583029025,18948766831@189.com,0,民营企业,有限责任公司,房地产业,房地产业,房地产开发经营,房地产开发经营,-,深圳市罗湖区东门街道花场社区人民北路3092号物资大厦1206,-,曾有债券发行,一般经营项目是：投资兴办实业（具体项目另行申报）；国内商业、物资供销业（不含专营、专控、专卖商品）；在合法取得土地使用权范围内从事房地产开发经营；自有物业租赁。，许可经营项目是：
125,126.0,雅生活智慧城市服务股份有限公司,在营,黄奉潮,14.2亿,人民币,1997-06-26,2023-11-09,广东省,中山市,-,91442000282096687C,0760-88368738,rlxzb.hnqy.yshjt@agile.com.cn,684,民营企业,股份有限公司,房地产业,房地产业,物业管理,物业管理,www.agileliving.com.cn,中国广东省中山市三乡镇雅居乐花园兴业路管理大厦,香港夏悫道16号远东金融中心17楼,曾有债券发行,家庭服务、物业管理服务；水电维修；室内装饰工程；园林绿化工程（公司属下小区经营）；中餐（分支机构经营）；西餐类制售（不含凉菜、裱花蛋糕、生食海产品）；茶艺；游泳；桌球；乒乓球；健身；网球；保龄球；高尔夫球练习场；棋牌（中国象棋、围棋、国际象棋、桥牌）；烧烤；滑草；电梯维修；停车场经营；家居清洁服务；健美操；壁球；划船；钓鱼场；足浴；美容美发（不含医疗美容，由分支机构经营）；房地产中介服务；零售：服装、鞋、箱、包、百货（食品除外）、文具用品、玩具、体育用品及器材、化妆品、卫生用品、帽、日用器皿、日用杂货；货物进出口（国家禁止或涉及行政审批的货物和技术进出口除外）（以上经营范围涉及货物进出口、技术进出口）（专营专控物品除外）；酒店管理服务；餐饮服务；设计、制作、发布、代理各类广告；市场营销策划服务；企业投资咨询（金融业务除外）（不含社会调查、市场调查）；智能设备研发、安装；应用软件运行维护服务；信息系统集成服务；计算机产品的开发、销售、安装；计算机软件技术开发、技术转让、技术咨询服务；大数据信息咨询服务；研发、销售：物联网软硬件产品；节能工程施工；环境监测服务；空气检测与治理；房地产咨询服务；人力资源服务；企业管理咨询服务；科技企业孵化器；营利性养老机构。（以上项目不涉及外商投资准入特别管理措施）（依法须经批准的项目，经相关部门批准后方可开展经营活动；根据粤府办【2014】24号文件，上述经营范围涉及：高危险性体育项目经营，公共场所经营，特种设备安装、改造、修理。）(依法须经批准的项目，经相关部门批准后方可开展经营活动)〓
126,127.0,禹洲物业服务有限公司,在营,薛亮,"5,000万",人民币,1997-05-22,2023-11-20,福建省,厦门市,思明区,91350200260131525Q,18030200610,crld_xmzhfw_zy@crland.com.cn,1,港澳台企业,有限责任公司,房地产业,房地产业,物业管理,物业管理,-,厦门市思明区禾祥西二路37号裙楼,-,曾有债券发行,一般项目：物业管理；房地产经纪；日用百货销售；装卸搬运；五金产品零售；日用家电零售；电子产品销售；洗染服务；互联网销售（除销售需要许可的商品）；城乡市容管理；建筑物清洁服务；园林绿化工程施工；家政服务；林业有害生物防治服务；停车场服务；规划设计管理；食品销售（仅销售预包装食品）；婴幼儿配方乳粉及其他婴幼儿配方食品销售；信息技术咨询服务；信息系统运行维护服务；城市绿化管理；环境保护监测；自然生态系统保护管理；大气污染治理；水污染治理；噪声与振动控制服务；信息系统集成服务；技术服务、技术开发、技术咨询、技术交流、技术转让、技术推广；大数据服务；软件开发；网络与信息安全软件开发；数据处理和存储支持服务；数据处理服务。（除依法须经批准的项目外，凭营业执照依法自主开展经营活动）许可项目：酒类经营；第一类增值电信业务；第二类增值电信业务；城市生活垃圾经营性服务；呼叫中心。（依法须经批准的项目，经相关部门批准后方可开展经营活动，具体经营项目以相关部门批准文件或许可证件为准）
127,128.0,上海宏慧创想众创空间管理有限公司,在营,康劼,"1,000万",人民币,1997-05-22,2023-11-16,上海市,-,黄浦区,91310101134501142X,021-63267162,-,3,民营企业,有限责任公司,房地产业,房地产业,房地产开发经营,房地产开发经营,-,上海市黄浦区虎丘路27号101、113室,-,曾有债券发行,众创空间经营管理，科技中介服务，从事科技推广和应用领域、计算机系统集成领域的技术开发、技术咨询、技术服务、技术转让，物业管理，住宿，酒店管理，自有房屋租赁，受托房屋租赁（仅限分支机构经营），办理动拆迁委托业务，停车场库经营，市场营销策划，商业经营管理（除市场管理），商务咨询，企业管理咨询，电子商务（不得从事金融业务），房地产经纪，企业并购与重组的策划，企业形象策划，自有设备租赁（除金融租赁），知识产权代理（除专利代理），会务服务，展览展示服务，餐饮服务。【依法须经批准的项目，经相关部门批准后方可开展经营活动】
128,129.0,新希望五新实业集团有限公司,在营,姜孟军,19.5亿,人民币,1997-05-07,2023-01-13,四川省,成都市,邛崃市,91510100633139520L,028-65721666,office@newhope.cn,338,民营企业,有限责任公司,房地产业,房地产业,房地产开发经营,房地产开发经营,www.newhopefdc.cn,成都市人民南路四段新希望集团,成都市锦江区金石路366号新希望中鼎国际,曾有债券发行,一般项目：企业管理；规划设计管理；工程管理服务；工程造价咨询业务；招投标代理服务；技术服务、技术开发、技术咨询、技术交流、技术转让、技术推广；市场营销策划；企业形象策划；信息咨询服务（不含许可类信息咨询服务）；社会经济咨询服务；财务咨询；企业管理咨询；劳务服务（不含劳务派遣）；日用百货销售；体育中介代理服务；文化娱乐经纪人服务；物联网应用服务；停车场服务。（除依法须经批准的项目外，凭营业执照依法自主开展经营活动）
129,130.0,宁波银亿物业管理有限公司,在营,屠赛利,1.8亿,人民币,1997-01-17,2023-11-01,浙江省,宁波市,海曙区,913302032541033414,87039102,nbyywy1997@163.com,2378,民营企业,有限责任公司,房地产业,房地产业,物业管理,物业管理,-,浙江省宁波市海曙区迎春街88弄13号三楼,-,曾有债券发行,一般项目：物业管理；物业服务评估；家政服务；家具安装和维修服务；停车场服务；餐饮管理；酒店管理；票务代理服务；会议及展览服务；建筑物清洁服务；城市绿化管理；专业保洁、清洗、消毒服务；住房租赁；非居住房地产租赁；广告设计、代理；水污染治理；本市范围内公共租赁住房的建设、租赁经营管理（除依法须经批准的项目外，凭营业执照依法自主开展经营活动）。许可项目：食品销售；城市生活垃圾经营性服务（依法须经批准的项目，经相关部门批准后方可开展经营活动，具体经营项目以审批结果为准）。以下限分支机构经营：许可项目：餐饮服务；高危险性体育运动（游泳）（依法须经批准的项目，经相关部门批准后方可开展经营活动，具体经营项目以审批结果为准）。
130,131.0,荣盛房地产发展股份有限公司,在营,邹家立,43.48亿,人民币,1996-12-30,2022-09-13,河北省,廊坊市,广阳区,911310002360777257,18331653082,-,101,民营企业,股份有限公司,房地产业,房地产业,房地产开发经营,房地产开发经营,www.risesun.cn,河北省廊坊市经济技术开发区祥云道81号荣盛发展大厦,河北省廊坊市经济技术开发区祥云道81号,曾有债券发行,房地产开发与经营（一级）。
131,132.0,国创高科实业集团有限公司,在营,高庆寿,3亿,人民币,1996-12-02,2017-12-19,湖北省,武汉市,东西湖区,914200006154096385,027-87617347,2461314926@qq.com,52,民营企业,有限责任公司,房地产业,房地产业,房地产中介服务,房地产中介服务,www.guochuangjituan.com,武汉市东西湖区新沟农场新华集,武汉市东西湖区新沟农场新华集,曾有债券发行,公路建设与经营管理，公路路用产品的研发、生产、销售，公路工程的施工；地产项目的开发销售；机电产品的研究、开发、销售。机械设备、仪器仪表、零配件及技术贸易；本企业所需原料进出口业务；本企业对外控股、参股的企业股权管理；企业管理咨询、财务咨询、信息咨询。（涉及许可经营项目，应取得相关部门许可后方可经营）
132,133.0,重庆爱普地产(集团)有限公司,在营,何才有,10亿,人民币,1996-11-06,2019-05-09,重庆市,-,江北区,91500105203120926M,02389887060,-,39,港澳台企业,有限责任公司,房地产业,房地产业,房地产开发经营,房地产开发经营,-,重庆市江北区东升门路63号19-办公用房,-,曾有债券发行,房地产综合开发（凭资质证书在许可范围及有效期内执业）；房屋销售；自有房屋租赁（不含住宿）；房地产信息咨询；销售金属材料（不含稀贵金属）、化工产品（不含化学危险品及易制毒化学物品）、电器机械及器材、五金、交电、通信设备（不含无线电发射和卫星接收装置）、现代办公设备、文化用品、百货（不含农膜）、建筑材料（不含化危品）。**[以上项目法律、法规禁止经营的不得经营；法律、法规规定应经审批而未获审批前不得经营]
133,134.0,铁岭新城投资控股(集团)股份有限公司,在营,侯强,8.25亿,人民币,1996-11-05,2023-11-08,辽宁省,铁岭市,铁岭县,91211200201909093K,024-74997887,17126101@qq.com,10,民营企业,股份有限公司,房地产业,房地产业,房地产开发经营,房地产开发经营,www.tielingnewcity.com.cn,辽宁省铁岭市凡河新区金沙江路12号,辽宁省铁岭市凡河新区金沙江路11号,曾有债券发行,风电场相关系统研发;风电场相关装备销售;技术服务、技术开发、技术咨询、技术交流、技术转让、技术推广;项目开发、投资、管理咨询。
134,135.0,美好置业集团股份有限公司,在营,刘道明,24.67亿,人民币,1996-10-17,2023-10-17,云南省,昆明市,盘龙区,9153000021665904XL,***********,mhzy@000667.com,6,民营企业,股份有限公司,房地产业,房地产业,房地产开发经营,房地产开发经营,www.000667.com,云南省昆明市北京路与联盟路交叉口卓越俊园10栋2单元2317室,湖北省武汉市汉阳区马鹦路191号美好广场35楼,曾有债券发行,许可项目：房地产开发经营（依法须经批准的项目，经相关部门批准后方可开展经营活动，具体经营项目以相关门部门批准文件或许可证件为准）一般项目：企业管理咨询；以自有资金从事投资活动；信息咨询服务（不含许可类信息咨询服务）；住房租赁；非居住房地产租赁；土地使用权租赁。
135,136.0,金辉集团股份有限公司,在营,林定强,18亿,人民币,1996-09-02,2023-03-29,福建省,福州市,晋安区,91350000611335221C,0591-86392015,380115022@qq.com,3,民营企业,股份有限公司,房地产业,房地产业,房地产开发经营,房地产开发经营,www.radiance.com.cn,福建省福州市晋安区茶园街道华林路492号金辉大厦3层,北京市朝阳区望京启阳路金辉大厦42层,曾有债券发行,在福州市晋安区福州火车客站南向华林路西侧建造、出租、出售金辉大厦项目，在福州市台江区排尾路北侧建造、出租、出售锦江花园项目，在晋安区鼓山镇红光、远中村建造、出租、出售东景家园B区项目，在晋安区浦东河东连洋路南建造、出租、出售东景家园C区项目，在晋安区鼓山镇连洋路南侧浦乾路东侧福光南路西侧建造、出租、出售东景家园C区二期项目，在福州市晋安区连洋路以南福光路与浦乾路之间规划路北侧建造、出租、出售东景家园C区一期项目，在福州市仓山区浦上路南侧浦上工业区“地王”1#地块建造、出租、出售金域蓝湾项目，在福州市仓山区则徐大道西侧原福州市医疗化工厂地块建造、出租、出售莱茵城项目，在福州市仓山区则徐大道西南侧建造、出租、出售莱茵城二期项目；物业管理；建筑业信息咨询服务；计算机系统设计、安装及软件开发；日用百货、五金、交电、建筑材料批发、代购代销。（依法须经批准的项目，经相关部门批准后方可开展经营活动）
136,137.0,杭州滨江房产集团股份有限公司,在营,戚金兴,31.11亿,人民币,1996-08-22,2022-02-16,浙江省,杭州市,上城区,91330000719577660B,86986667,office@binjiang.com.cn,57,民营企业,股份有限公司,房地产业,房地产业,房地产开发经营,房地产开发经营,www.binjiang.com.cn,浙江省杭州市庆春东路38号,浙江省杭州市庆春东路38号,曾有债券发行,"房地产开发,房屋建筑,商品房销售,水电安装,室内外装璜;含下属分支机构的经营范围;其他无需报经审批的一切合法项目。"
137,138.0,广州广电房地产开发集团股份有限公司,在营,李鹏,6.5亿,人民币,1996-08-19,2021-09-30,广东省,广州市,天河区,9144010123124837XM,32528000,372633932@qq.com,94,港澳台企业,股份有限公司,房地产业,房地产业,房地产开发经营,房地产开发经营,-,广州市天河区平云路163号广电科技大厦1401房，广电科技大厦1501房,-,曾有债券发行,室内装饰、设计;金属制品批发;通用机械设备销售;化工产品批发（危险化学品除外）;建材、装饰材料批发;五金产品批发;房地产开发经营;房屋建筑工程施工;汽车批发（九座以下小轿车除外）;摩托车零配件批发;日用杂品综合零售;建筑工程后期装饰、装修和清理;
138,139.0,上海大名城企业股份有限公司,在营,俞锦,24.75亿,人民币,1996-07-18,2024-01-09,上海市,-,闵行区,913100006073563962,021-62470088,dmc@greattown.cn,16,民营企业,股份有限公司,房地产业,房地产业,房地产开发经营,房地产开发经营,www.greattown.cn,上海市闵行区红松东路1116号1幢5楼A区,上海市长宁区红宝石路500号东银中心B栋29楼,曾有债券发行,"房地产综合开发,建造、销售商品房;物业管理,物业租赁;公共基础设施开发与建设;建筑装饰安装工程;从事新能源科技领域的技术开发、技术咨询、技术服务、技术转让,新能源汽车的销售;生产、加工、销售生物制品、农药及中间体、药品原料及制剂、保健品、新型建材、包装材料、现代通讯信息新材料及相关器件,以及上述产品的研究开发、技术咨询和售后服务;经营进出口业务(涉及配额、许可证或国家专项管理的,应凭证经营或按国家有关规定另行报批)。"
